Name|Description|Value|Direction|Rationale|Impact|ParameterName|KeyName
Контроль учетных записей: режим одобрения администратором для встроенной учетной записи администратора|Этот параметр политики управляет поведением режима утверждения администратором для встроенной учетной записи администратора.|1||Один из рисков, который пытается снизить функция контроля учетных записей пользователей, введенная в Windows Vista, заключается в том, что вредоносное программное обеспечение запускается с повышенными учетными данными без ведома пользователя или администратора о его действиях. Вектор атаки для этих программ состоял в том, чтобы узнать пароль учетной записи с именем "Администратор", поскольку эта учетная запись пользователя была создана для всех установок Windows. Чтобы устранить этот риск, в Windows Vista и новее, встроенная учетная запись администратора теперь отключена по умолчанию. В одном при установке нового компьютера по умолчанию учетные записи с административным контролем над компьютером изначально настраиваются одним из двух способов: 1) Если компьютер не подключен к домену, первая учетная запись пользователя, которую вы создаете, имеет разрешения, эквивалентные разрешениям локального администратора. 2) Если компьютер присоединен к домену, учетные записи локального администратора не создаются. Администратор предприятия или домена должен войти на компьютер и создать его, если требуется учетная запись локального администратора. После установки Windows встроенная учетная запись администратора может быть включена вручную, но мы настоятельно рекомендуем, чтобы эта учетная запись оставалась отключенной.|Режим утверждения пользователей встроенной учетной записи администратора администратором. Пользователям, которые входят в систему с использованием учетной записи локального администратора, будет предложено дать согласие всякий раз, когда программа запрашивает повышение привилегий, как и любому другому пользователю.|FilterAdministratorToken|HKEY_LOCAL_MACHINE\SOFTWARE\Microsoft\Windows\CurrentVersion\Policies\System
Контроль учетных записей: поведение запроса на повышение привилегий для администраторов в режиме одобрения администратором|Этот параметр политики управляет поведением запроса на повышение прав для администраторов. Рекомендуемое состояние для этого параметра: Запрос согласия на безопасном рабочем столе.|2||Один из рисков, который пытается снизить функция UAC, введенная в Windows Vista, заключается в том, что вредоносное программное обеспечение запускается с повышенными учетными данными без ведома пользователя или администратора о его активности. Этот параметр повышает осведомленность администратора об операциях с повышенными привилегиями и позволяет администратору предотвращать повышение привилегий вредоносной программы, когда программа пытается это сделать.|Когда операция (включая выполнение двоичного файла Windows) требует повышения привилегий, пользователю предлагается на защищенном рабочем столе выбрать либо Разрешить, либо Запретить. Если пользователь выбирает Разрешить, операция продолжается с наивысшими доступными привилегиями пользователя.|ConsentPromptBehaviorAdmin|HKEY_LOCAL_MACHINE\SOFTWARE\Microsoft\Windows\CurrentVersion\Policies\System
Контроль учетных записей: поведение запроса на повышение привилегий для обычных пользователей|Этот параметр политики управляет поведением запроса на повышение прав для обычных пользователей. Рекомендуемое состояние для этого параметра: Автоматически отклонять запросы на повышение прав.|0||Один из рисков, который пытается снизить функция контроля учетных записей пользователей, введенная в Windows Vista, заключается в том, что вредоносные программы запускаются с повышенными учетными данными без ведома пользователя или администратора об их активности. Этот параметр повышает осведомленность пользователя о том, что программа требует использования операций с повышенными привилегиями и требует, чтобы пользователь мог предоставить учетные данные администратора для запуска программы.|Когда операция требует повышения привилегий, отображается настраиваемое сообщение об ошибке "отказано в доступе". Предприятие, использующее настольные компьютеры в качестве стандартного пользователя, может выбрать этот параметр, чтобы сократить количество обращений в службу поддержки.|ConsentPromptBehaviorUser|HKEY_LOCAL_MACHINE\SOFTWARE\Microsoft\Windows\CurrentVersion\Policies\System
Контроль учетных записей: обнаружение установки приложений и запрос на повышение привилегий|Этот параметр политики управляет поведением обнаружения установки приложения на компьютере.|1||Некоторые вредоносные программы попытаются установить себя после получения разрешения на запуск. Например, вредоносное программное обеспечение с доверенной оболочкой приложения. Пользователь, возможно, дал разрешение на запуск программы, поскольку программа является доверенной, но, если затем ему будет предложено установить неизвестный компонент, то это обеспечит еще один способ перехватить программное обеспечение, прежде чем оно сможет нанести ущерб.|При обнаружении пакета установки приложения, требующего повышения привилегий, пользователю предлагается ввести имя пользователя и пароль администратора. Если пользователь вводит действительные учетные данные, операция продолжается с соответствующими привилегиями.|EnableInstallerDetection|HKEY_LOCAL_MACHINE\SOFTWARE\Microsoft\Windows\CurrentVersion\Policies\System
Контроль учетных записей: повышать права только для UIAccess-приложений, установленных в безопасном местоположении|Этот параметр политики определяет, будут ли приложения, запрашивающие запуск с пользовательским интерфейсом Уровень целостности доступности (UIAccess) должен находиться в безопасном расположении файловой системы. Безопасные места ограничены следующими: 1) ...\Program Files\, включая вложенные папки; 2) ...\Windows\System32\; 3) ...\Program Files (x86)\, включая вложенные папки (для 64-разрядных версий Windows).|1||Целостность UIAccess позволяет приложению обходить изоляцию привилегий пользовательского интерфейса (UIPI) ограничения, когда привилегии приложения повышаются с обычного пользователя до администратора. Это необходимо для поддержки специальных функций, таких как программы чтения с экрана, которые передают пользовательские интерфейсы в альтернативные формы. Процесс, который запускается с Правами UIAccess обладает следующими возможностями: 1) Чтобы установить окно переднего плана; 2) Для управления любым окном приложения с помощью функции SendInput; 3) Чтобы использовать ввод для чтения для всех уровней целостности, используя низкоуровневые крючки, необработанный ввод, GetKeyState, GetAsyncKeyState и получите ввод с клавиатуры; 4) Чтобы установить крючки журнала; 5) Использовать AttachThreadInput для присоединения потока к очереди ввода с более высокой целостностью.|Отключен - это значение по умолчанию.|EnableSecureUIAPaths|HKEY_LOCAL_MACHINE\SOFTWARE\Microsoft\Windows\CurrentVersion\Policies\System
Контроль учетных записей: включение режима одобрения администратором|Этот параметр политики управляет поведением всех параметров политики контроля учетных записей пользователей (UAC) для компьютера. Если вы измените этот параметр политики, вам необходимо перезагрузить свой компьютер.|1||Это настройка, которая включает или выключает UAC. Если этот параметр отключен, UAC не будет использоваться, и любые преимущества безопасности и меры по снижению рисков, зависящие от UAC, не будут присутствовать в системе.|Отключен - это значение по умолчанию. Пользователям и администраторам необходимо будет научиться работать с запросами UAC и скорректировать свои рабочие привычки, чтобы использовать операции с наименьшими привилегиями.|EnableLUA|HKEY_LOCAL_MACHINE\SOFTWARE\Microsoft\Windows\CurrentVersion\Policies\System
Контроль учетных записей: переключение к безопасному рабочему столу при выполнении запроса на повышение прав|Этот параметр политики определяет, отображается ли запрос на повышение прав на рабочем столе интерактивного пользователя или на защищенном рабочем столе.|1||Стандартные диалоговые окна запроса на повышение прав могут быть подделаны, что может привести к раскрытию пользователями своих паролей вредоносному программному обеспечению. Защищенный рабочий стол имеет очень четкий внешний вид при запросе прав доступа, когда рабочий стол пользователя затемняется, а пользовательский интерфейс запроса прав доступа становится более заметным. Это повышает вероятность того, что пользователи, привыкшие к защищенному рабочему столу, распознают поддельное диалоговое окно запроса на повышение прав и не попадутся на уловку.|Отключен - это значение по умолчанию.|PromptOnSecureDesktop|HKEY_LOCAL_MACHINE\SOFTWARE\Microsoft\Windows\CurrentVersion\Policies\System
Контроль учетных записей: виртуализация сбоев записи в файл или реестр на основании расположений пользователя|Этот параметр политики определяет, перенаправляются ли сбои при записи приложений в определенные местоположения реестра и файловой системы. Этот параметр политики уменьшает количество приложений, которые запускаются от имени администратора и записывают данные приложения во время выполнения в: 1) %ProgramFiles%; 2) %windir%; 3) %windir%\System32; 4) HKEY_LOCAL_MACHINE\SOFTWARE.|1||Этот параметр уменьшает уязвимости, гарантируя, что устаревшие приложения записывают данные только в разрешенные местоположения.|Отключен - это значение по умолчанию.|EnableVirtualization|HKEY_LOCAL_MACHINE\SOFTWARE\Microsoft\Windows\CurrentVersion\Policies\System